{
  "schema_version": "1.0.0",
  "catalog_id": "ct-advisor-public-resource-catalog",
  "catalog_version": "1.0.0",
  "published_at": "2026-10-23T00:00:00.000Z",
  "resources": [
    {
      "schema_version": "1.0.0",
      "resource_id": "advisor_resource_00000000-0000-4000-8000-000000000001",
      "resource_type": "gpu",
      "canonical_key": "synthetic.gpu.accelerator-alpha",
      "display_name": "Synthetic Accelerator Alpha",
      "lifecycle_status": "active",
      "visibility": "public",
      "data_class": "synthetic",
      "facts": [
        { "field_id": "gpu.vendor", "status": "provided", "value": "Synthetic Systems", "unit": "none" },
        { "field_id": "gpu.model", "status": "provided", "value": "Accelerator Alpha", "unit": "none" },
        { "field_id": "gpu.memory_capacity", "status": "provided", "value": 80, "unit": "gibibytes" },
        { "field_id": "gpu.supported_precisions", "status": "provided", "value": ["FP16", "BF16"], "unit": "none" },
        { "field_id": "gpu.interconnects", "status": "provided", "value": ["SyntheticLink"], "unit": "none" }
      ],
      "source_snapshot": {
        "schema_version": "1.0.0",
        "snapshot_id": "advisor_source_10000000-0000-4000-8000-000000000001",
        "data_class": "synthetic",
        "kind": "synthetic",
        "confidence": "high",
        "publisher": "CloudTelecom",
        "title": "Synthetic GPU catalog fixture",
        "reference_url": "repo://ct-aicomm/examples/advisor/synthetic-resource-catalog-v1.json#gpu",
        "observed_at": "2026-10-23T00:00:00.000Z",
        "effective_from": "2026-10-01T00:00:00.000Z",
        "expires_at": "2027-01-01T00:00:00.000Z",
        "authorization": { "basis": "internal_synthetic", "analysis_use": "allowed", "redistribution": "allowed", "reference": "Apache-2.0 synthetic fixture" },
        "summary": "Synthetic GPU facts for validator and user-interface testing; not a vendor or performance claim.",
        "content_sha256": "sha256:1e6f323508efe179a026614172f4604a4dbaa16b4b48764fa4caf7cb9ade4812"
      },
      "recorded_at": "2026-10-23T00:00:00.000Z",
      "content_sha256": "sha256:68a61705ba46d1ef01f9f02ef88df4e70cf220576b1b36be0d94882a3580a17a",
      "boundaries": { "decision_support_only": true, "execution_authorized": false, "performance_claim_allowed": false }
    },
    {
      "schema_version": "1.0.0",
      "resource_id": "advisor_resource_00000000-0000-4000-8000-000000000002",
      "resource_type": "cloud_instance",
      "canonical_key": "synthetic.cloud.instance-alpha",
      "display_name": "Synthetic Cloud GPU Instance Alpha",
      "lifecycle_status": "active",
      "visibility": "public",
      "data_class": "synthetic",
      "facts": [
        { "field_id": "cloud.provider", "status": "provided", "value": "Example Compute", "unit": "none" },
        { "field_id": "cloud.instance_type", "status": "provided", "value": "gpu.alpha.8", "unit": "none" },
        { "field_id": "cloud.gpu_resource_ref", "status": "provided", "value": "advisor_resource_00000000-0000-4000-8000-000000000001", "unit": "none" },
        { "field_id": "cloud.gpu_count", "status": "provided", "value": 8, "unit": "gpu_count" },
        { "field_id": "cloud.vcpu_count", "status": "provided", "value": 128, "unit": "count" },
        { "field_id": "cloud.host_memory", "status": "provided", "value": 1024, "unit": "gibibytes" }
      ],
      "source_snapshot": {
        "schema_version": "1.0.0",
        "snapshot_id": "advisor_source_10000000-0000-4000-8000-000000000002",
        "data_class": "synthetic",
        "kind": "synthetic",
        "confidence": "high",
        "publisher": "CloudTelecom",
        "title": "Synthetic cloud instance fixture",
        "reference_url": "repo://ct-aicomm/examples/advisor/synthetic-resource-catalog-v1.json#cloud-instance",
        "observed_at": "2026-10-23T00:00:00.000Z",
        "effective_from": "2026-10-01T00:00:00.000Z",
        "expires_at": "2027-01-01T00:00:00.000Z",
        "authorization": { "basis": "internal_synthetic", "analysis_use": "allowed", "redistribution": "allowed", "reference": "Apache-2.0 synthetic fixture" },
        "summary": "Synthetic cloud-instance facts for deterministic tests; not an availability or capacity commitment.",
        "content_sha256": "sha256:1a5f51c9ca9b3c72f91579bb2325f370df04756685509e18d462e79eb9f5edc2"
      },
      "recorded_at": "2026-10-23T00:00:00.000Z",
      "content_sha256": "sha256:aa762ae905be80571d5d96d5c494a0e0bb0103f066c0b1c3eef235b66e9dfce9",
      "boundaries": { "decision_support_only": true, "execution_authorized": false, "performance_claim_allowed": false }
    },
    {
      "schema_version": "1.0.0",
      "resource_id": "advisor_resource_00000000-0000-4000-8000-000000000003",
      "resource_type": "region",
      "canonical_key": "synthetic.region.east-1",
      "display_name": "Synthetic Region East 1",
      "lifecycle_status": "active",
      "visibility": "public",
      "data_class": "synthetic",
      "facts": [
        { "field_id": "region.provider", "status": "provided", "value": "Example Compute", "unit": "none" },
        { "field_id": "region.code", "status": "provided", "value": "example-east-1", "unit": "none" },
        { "field_id": "region.country_code", "status": "provided", "value": "ZZ", "unit": "none" },
        { "field_id": "region.jurisdiction", "status": "provided", "value": "Synthetic jurisdiction", "unit": "none" }
      ],
      "source_snapshot": {
        "schema_version": "1.0.0",
        "snapshot_id": "advisor_source_10000000-0000-4000-8000-000000000003",
        "data_class": "synthetic",
        "kind": "synthetic",
        "confidence": "high",
        "publisher": "CloudTelecom",
        "title": "Synthetic region fixture",
        "reference_url": "repo://ct-aicomm/examples/advisor/synthetic-resource-catalog-v1.json#region",
        "observed_at": "2026-10-23T00:00:00.000Z",
        "effective_from": "2026-10-01T00:00:00.000Z",
        "expires_at": "2027-01-01T00:00:00.000Z",
        "authorization": { "basis": "internal_synthetic", "analysis_use": "allowed", "redistribution": "allowed", "reference": "Apache-2.0 synthetic fixture" },
        "summary": "Synthetic regional identity and jurisdiction facts for residency workflow testing only.",
        "content_sha256": "sha256:35932b775ac6c26d9742d6ababd93a9ae3413d72459a2820452d7d10fc239910"
      },
      "recorded_at": "2026-10-23T00:00:00.000Z",
      "content_sha256": "sha256:300f57c2b7adba30ca635d6e7b8c7fa212799db5c37b20bba2b688c48ea58ec2",
      "boundaries": { "decision_support_only": true, "execution_authorized": false, "performance_claim_allowed": false }
    },
    {
      "schema_version": "1.0.0",
      "resource_id": "advisor_resource_00000000-0000-4000-8000-000000000004",
      "resource_type": "network_path",
      "canonical_key": "synthetic.network.east-to-west",
      "display_name": "Synthetic East-to-West Network Path",
      "lifecycle_status": "active",
      "visibility": "public",
      "data_class": "synthetic",
      "facts": [
        { "field_id": "network.endpoint_a", "status": "provided", "value": "synthetic.region.east-1", "unit": "none" },
        { "field_id": "network.endpoint_b", "status": "provided", "value": "synthetic.region.west-1", "unit": "none" },
        { "field_id": "network.round_trip_latency", "status": "provided", "value": 38, "unit": "milliseconds" },
        { "field_id": "network.bandwidth", "status": "provided", "value": 100, "unit": "gigabits_per_second" },
        { "field_id": "network.packet_loss", "status": "provided", "value": 0.1, "unit": "percent" }
      ],
      "source_snapshot": {
        "schema_version": "1.0.0",
        "snapshot_id": "advisor_source_10000000-0000-4000-8000-000000000004",
        "data_class": "synthetic",
        "kind": "synthetic",
        "confidence": "high",
        "publisher": "CloudTelecom",
        "title": "Synthetic network-path fixture",
        "reference_url": "repo://ct-aicomm/examples/advisor/synthetic-resource-catalog-v1.json#network-path",
        "observed_at": "2026-10-23T00:00:00.000Z",
        "effective_from": "2026-10-01T00:00:00.000Z",
        "expires_at": "2027-01-01T00:00:00.000Z",
        "authorization": { "basis": "internal_synthetic", "analysis_use": "allowed", "redistribution": "allowed", "reference": "Apache-2.0 synthetic fixture" },
        "summary": "Synthetic latency, bandwidth, and loss values for comparison tests; not measured service quality.",
        "content_sha256": "sha256:6853c06b733ca7cf59e11f044e3308cd27d512fe3894f86a32d341f5030e98d0"
      },
      "recorded_at": "2026-10-23T00:00:00.000Z",
      "content_sha256": "sha256:5870cc1a7e7e3ceb3bc32492ff4c1f3e6d5fcd912e0083f2be1fcb9892ce74b1",
      "boundaries": { "decision_support_only": true, "execution_authorized": false, "performance_claim_allowed": false }
    },
    {
      "schema_version": "1.0.0",
      "resource_id": "advisor_resource_00000000-0000-4000-8000-000000000005",
      "resource_type": "software_stack",
      "canonical_key": "synthetic.software.inference-runtime",
      "display_name": "Synthetic Inference Runtime",
      "lifecycle_status": "active",
      "visibility": "public",
      "data_class": "synthetic",
      "facts": [
        { "field_id": "software.component", "status": "provided", "value": "Synthetic Inference Runtime", "unit": "none" },
        { "field_id": "software.version", "status": "provided", "value": "1.0.0", "unit": "none" },
        { "field_id": "software.compatible_resource_refs", "status": "provided", "value": ["advisor_resource_00000000-0000-4000-8000-000000000001"], "unit": "none" }
      ],
      "source_snapshot": {
        "schema_version": "1.0.0",
        "snapshot_id": "advisor_source_10000000-0000-4000-8000-000000000005",
        "data_class": "synthetic",
        "kind": "synthetic",
        "confidence": "high",
        "publisher": "CloudTelecom",